{
  "SPDX-FileCopyrightText": "Copyright (C) 2026 DeepSig Inc.",
  "SPDX-License-Identifier": "BSD-3-Clause-Clear",
  "$schema": "../../../schemas/dapp/class-a-cuda-qualification-policy-v1.schema.json",
  "schema": "ocudu.class-a-cuda-qualification-policy.v1",
  "platform_id": "replace-with-release-platform-id",
  "scheduler_policy": "fifo",
  "minimum_scheduler_priority": 20,
  "cpu_affinity": "replace-with-isolated-cpu-set",
  "pusch_stream_priority": "high",
  "gpu_clock_policy": "replace-with-deployment clock-control policy",
  "gpu_power_policy": "replace-with-deployment power-control policy",
  "maximum_gpu_temperature_c": 80,
  "release_controls_approved": true,
  "required_gpu_persistence_mode": "enabled",
  "required_gpu_compute_mode": "default",
  "operator_notes": "Copy this file and replace every deployment-specific value before collecting release evidence."
}
